category,label_name,note,num,onboard_time,rank,raw_hot,star_name,word,word_scheme
艺人,爆,胡歌 我当爸爸啦,13138389,1675148478,0,13138389,胡歌,胡歌 我当爸爸啦,胡歌 我当爸爸啦
社会新闻,热,胡鑫宇购买录音笔数据删除后无法恢复,2837314,1675150696,1,2837314,{},胡鑫宇购买录音笔数据删除后无法恢复,#胡鑫宇购买录音笔数据删除后无法恢复#
社会新闻,新,一批新规2月开始施行,1549566,1675154085,2,208812,{},一批新规2月开始施行,#一批新规2月开始施行#
社会新闻,热,保时捷官网12.4万元帕纳梅拉遭抢购,1343466,1675146149,3,1343466,{},保时捷官网12.4万元帕纳梅拉遭抢购,#保时捷官网12.4万元帕纳梅拉遭抢购#
社会负面,,母子围炉煮茶一氧化碳中毒身亡,864612,1675152118,4,864612,{},母子围炉煮茶一氧化碳中毒身亡,#母子围炉煮茶一氧化碳中毒身亡#
情感,,初四相亲初八订婚算闪婚吗,725283,1675150924,5,725283,{},初四相亲初八订婚算闪婚吗,#初四相亲初八订婚算闪婚吗#
